{
  "domain_id": "chc",
  "name": "CHC Ops",
  "version": "v1",
  "supported_task_types": [
    "EXECUTE",
    "ANALYZE",
    "ESCALATE"
  ],
  "scopes": {
    "ANALYZE": [
      "chc:read",
      "chc:analyze"
    ],
    "EXECUTE": [
      "chc:execute"
    ],
    "ESCALATE": [
      "chc:escalate"
    ]
  },
  "meta": {
    "updated_by": "scripts/normalize_domain_specs_v1.mjs",
    "updated_at": "2026-01-27T00:13:19.370Z",
    "extras": {
      "tasks": [
        {
          "task_type": "ANALYZE",
          "required_scope_any": [
            "chc:read",
            "chc:analyze"
          ]
        },
        {
          "task_type": "EXECUTE",
          "required_scope_any": [
            "chc:execute"
          ]
        },
        {
          "task_type": "ESCALATE",
          "required_scope_any": [
            "chc:escalate"
          ]
        }
      ]
    }
  }
}
